{"format":4,"type":"oop_enforcement_install_profile","controller_interface":"oop-admission-1","source_binding":{"kind":"source_content","source_identity":"sha256:153af2e4a9812fcc9bc16ea5a89e2fcf6ef9687ab5ddda44ca7b51baf4462eea"},"adoption":"independently_adopted_full_git_commit_not_source_snapshot","features":[{"feature":"entry","purpose":"Deliver current workspace-bound context before substantive work.","phases":["session_entry"],"required_semantics":{"role":"context_delivery","blocking_required":false},"capability_classes":["persistent_context_injection","native_context_callback","native_execution_policy"],"required_coverage":{"phases":["session_entry"],"paths":"all_authenticated_applicable_paths","applicability":"always","minimum_tier":0,"complementary_paths":"each_path_is_a_separate_requirement"},"input_mapping":{"schema_ref":"interfaces.json#enforcement/schemas/request","format":1,"command":"entry","fields":["request_id","scope","context","evidence","effect_class","transition","bootstrap_step","journal"],"facts":"independently_authenticated_current_host_observations","correlation":"unique_request_id","unknown":"block_dependent_scope"},"output_mapping":{"schema_ref":"interfaces.json#enforcement/schemas/response","type":"oop_admission","correlation":["request_id","command","source_binding"],"exit_statuses":{"allow":0,"deny":2,"unknown":3,"error":4},"allow":"not_granted","failure":"block_dependent_scope","veto":"only_actual_native_veto_power","timeout":"fail_closed_without_claiming_underlying_cancellation"},"shareability":{"required_equal":["registration","invocation","scope","authority","permissions"],"required_per_feature":["phase","path","semantic_role","blocking_power"],"selection":"all_distinct_eligible_reuse_equivalents"},"fallback":{"unknown":"block_dependent_scope","unsupported":"block_dependent_scope","unauthorized":"preserve_owner_restrictions","independent_work":"retain_authorized_safe_work","diagnostics":"never_automatic_during_bootstrap"},"verification":{"basis":"direct_administrative_acknowledgment","active_hook_tests":0,"required":["invocation","scope","provenance","installation_completed","native_consent_resolved","restart_resolved","real_error_absent"],"invalidation":["source","runtime_build","permissions","configuration","scope","authority","revision","capabilities"],"assurance":"administrative_presumption_not_empirical_interception"},"source_refs":["OOP-enforcement-autonomy","OOP-transitions-routing","OOP-runtime-adoption","OOP-capability-lifecycle","OOP-free-first","OOP-full-install","OOP-bootstrap-system","OOP-delegate-governance"]},{"feature":"interaction","purpose":"Deliver current per-turn governance without granting effect permission.","phases":["user_interaction"],"required_semantics":{"role":"context_delivery","blocking_required":false},"capability_classes":["persistent_context_injection","native_context_callback","native_execution_policy"],"required_coverage":{"phases":["user_interaction"],"paths":"all_authenticated_applicable_paths","applicability":"always","minimum_tier":0,"complementary_paths":"each_path_is_a_separate_requirement"},"input_mapping":{"schema_ref":"interfaces.json#enforcement/schemas/request","format":1,"command":"interaction","fields":["request_id","scope","context","evidence","effect_class","transition","bootstrap_step","journal"],"facts":"independently_authenticated_current_host_observations","correlation":"unique_request_id","unknown":"block_dependent_scope"},"output_mapping":{"schema_ref":"interfaces.json#enforcement/schemas/response","type":"oop_admission","correlation":["request_id","command","source_binding"],"exit_statuses":{"allow":0,"deny":2,"unknown":3,"error":4},"allow":"not_granted","failure":"block_dependent_scope","veto":"only_actual_native_veto_power","timeout":"fail_closed_without_claiming_underlying_cancellation"},"shareability":{"required_equal":["registration","invocation","scope","authority","permissions"],"required_per_feature":["phase","path","semantic_role","blocking_power"],"selection":"all_distinct_eligible_reuse_equivalents"},"fallback":{"unknown":"block_dependent_scope","unsupported":"block_dependent_scope","unauthorized":"preserve_owner_restrictions","independent_work":"retain_authorized_safe_work","diagnostics":"never_automatic_during_bootstrap"},"verification":{"basis":"direct_administrative_acknowledgment","active_hook_tests":0,"required":["invocation","scope","provenance","installation_completed","native_consent_resolved","restart_resolved","real_error_absent"],"invalidation":["source","runtime_build","permissions","configuration","scope","authority","revision","capabilities"],"assurance":"administrative_presumption_not_empirical_interception"},"source_refs":["OOP-enforcement-autonomy","OOP-transitions-routing","OOP-runtime-adoption","OOP-capability-lifecycle","OOP-free-first","OOP-full-install","OOP-bootstrap-system","OOP-delegate-governance"]},{"feature":"pre-effect","purpose":"Prevent a dependent effect until admission and independent authority are established.","phases":["before_effect"],"required_semantics":{"role":"preventive_gate","blocking_required":true},"capability_classes":["native_execution_policy","external_pre_effect_wrapper","verified_backend_conditional_write"],"required_coverage":{"phases":["before_effect"],"paths":"all_authenticated_applicable_paths","applicability":"effects_possible","minimum_tier":0,"complementary_paths":"each_path_is_a_separate_requirement"},"input_mapping":{"schema_ref":"interfaces.json#enforcement/schemas/request","format":1,"command":"pre-effect","fields":["request_id","scope","context","evidence","effect_class","transition","bootstrap_step","journal"],"facts":"independently_authenticated_current_host_observations","correlation":"unique_request_id","unknown":"block_dependent_scope"},"output_mapping":{"schema_ref":"interfaces.json#enforcement/schemas/response","type":"oop_admission","correlation":["request_id","command","source_binding"],"exit_statuses":{"allow":0,"deny":2,"unknown":3,"error":4},"allow":"conditional_on_independent_adapter_authority","failure":"block_dependent_scope","veto":"only_actual_native_veto_power","timeout":"fail_closed_without_claiming_underlying_cancellation"},"shareability":{"required_equal":["registration","invocation","scope","authority","permissions"],"required_per_feature":["phase","path","semantic_role","blocking_power"],"selection":"all_distinct_eligible_reuse_equivalents"},"fallback":{"unknown":"block_dependent_scope","unsupported":"block_dependent_scope","unauthorized":"preserve_owner_restrictions","independent_work":"retain_authorized_safe_work","diagnostics":"never_automatic_during_bootstrap"},"verification":{"basis":"direct_administrative_acknowledgment","active_hook_tests":0,"required":["invocation","scope","provenance","installation_completed","native_consent_resolved","restart_resolved","real_error_absent"],"invalidation":["source","runtime_build","permissions","configuration","scope","authority","revision","capabilities"],"assurance":"administrative_presumption_not_empirical_interception"},"source_refs":["OOP-enforcement-autonomy","OOP-transitions-routing","OOP-runtime-adoption","OOP-capability-lifecycle","OOP-free-first","OOP-full-install","OOP-bootstrap-system","OOP-delegate-governance"]},{"feature":"post-effect","purpose":"Observe actual consequences and validate postconditions; cannot undo an effect.","phases":["after_effect"],"required_semantics":{"role":"observation","blocking_required":false},"capability_classes":["native_post_effect_observer","external_postcondition_validator"],"required_coverage":{"phases":["after_effect"],"paths":"all_authenticated_applicable_paths","applicability":"effects_possible","minimum_tier":0,"complementary_paths":"each_path_is_a_separate_requirement"},"input_mapping":{"schema_ref":"interfaces.json#enforcement/schemas/request","format":1,"command":"post-effect","fields":["request_id","scope","context","evidence","effect_class","transition","bootstrap_step","journal"],"facts":"independently_authenticated_current_host_observations","correlation":"unique_request_id","unknown":"block_dependent_scope"},"output_mapping":{"schema_ref":"interfaces.json#enforcement/schemas/response","type":"oop_admission","correlation":["request_id","command","source_binding"],"exit_statuses":{"allow":0,"deny":2,"unknown":3,"error":4},"allow":"not_granted","failure":"record_failure_and_block_dependent_continuation","veto":"only_actual_native_veto_power","timeout":"fail_closed_without_claiming_underlying_cancellation"},"shareability":{"required_equal":["registration","invocation","scope","authority","permissions"],"required_per_feature":["phase","path","semantic_role","blocking_power"],"selection":"all_distinct_eligible_reuse_equivalents"},"fallback":{"unknown":"block_dependent_scope","unsupported":"block_dependent_scope","unauthorized":"preserve_owner_restrictions","independent_work":"retain_authorized_safe_work","diagnostics":"never_automatic_during_bootstrap"},"verification":{"basis":"direct_administrative_acknowledgment","active_hook_tests":0,"required":["invocation","scope","provenance","installation_completed","native_consent_resolved","restart_resolved","real_error_absent"],"invalidation":["source","runtime_build","permissions","configuration","scope","authority","revision","capabilities"],"assurance":"administrative_presumption_not_empirical_interception"},"source_refs":["OOP-enforcement-autonomy","OOP-transitions-routing","OOP-runtime-adoption","OOP-capability-lifecycle","OOP-free-first","OOP-full-install","OOP-bootstrap-system","OOP-delegate-governance"]},{"feature":"completion","purpose":"Block unsupported completion claims where the host supports a completion veto.","phases":["before_completion"],"required_semantics":{"role":"completion_blocking","blocking_required":true},"capability_classes":["native_completion_gate","external_completion_gate"],"required_coverage":{"phases":["before_completion"],"paths":"all_authenticated_applic